id,timestamp,title,author,year,type,link,database,category,cover_image,🔐 Softr Record ID
4bbec61f-ace4-4a1b-b54a-dbb0eb86b533,24/08/2025 02:37:52,DESENVOLVIMENTO DE GUIA DE CORTE CIRÚRGICO CUSTOMIZADO PARA MANDIBULOTOMIA EM CIRURGIA DE CABEÇA E PESCOÇO ATRAVÉS DA MANUFATURA ADITIVA / DEVELOPMENT OF THE PERSONALIZED SURGICAL CUTTING GUIDE FOR MANDIBULOTOMY IN HEAD AND NECK SURGERY THROUGH ADDITIVE MANUFACTURING,Autor desconhecido,,Artigo,https://www.educacaografica.inf.br/artigos/desenvolvimento-de-guia-de-corte-cirurgico-customizado-para-mandibulotomia-em-cirurgia-de-cabeca-e-pescoco-atraves-da-manufatura-aditiva-development-of-the-personalized-surgical-cutting-guide-for-ma,Educação Gráfica,ux,,
261c1449-30df-4f41-80da-53f9020697d0,24/08/2025 02:37:52,SEGURANÇA NO CICLISMO: UMA REVISÃO SISTEMÁTICA DE LITERATURA DA PRODUÇÃO BRASILEIRA ENTRE 2014 E 2018 / SAFETY IN CYCLING: A SYSTEMATIC REVIEW OF BRAZILIAN PRODUCTION LITERATURE BETWEEN 2014 AND 2018,Autor desconhecido,,Artigo,https://www.educacaografica.inf.br/artigos/seguranca-no-ciclismo-uma-revisao-sistematica-de-literatura-da-producao-brasileira-entre-2014-e-2018-safety-in-cycling-a-systematic-review-of-brazilian-production-literature-between-2014-and-2018,Educação Gráfica,ux,,
f419d3df-c6ac-416d-84a6-c7a309b1f151,24/08/2025 02:37:52,GUIA VISUAL PARA A SISTEMATIZAÇÃO DE MÉTODOS DE POSICIONAMENTO DE PESSOAS EM CADEIRA DE RODAS / VISUAL GUIDE FOR METHODS SYSTEMATIZATION FOR POSITIONING PEOPLE IN A WHEELCHAIR,Autor desconhecido,,Artigo,https://www.educacaografica.inf.br/artigos/guia-visual-para-a-sistematizacao-de-metodos-de-posicionamento-de-pessoas-em-cadeira-de-rodas-visual-guide-for-methods-systematization-for-positioning-people-in-a-wheelchair,Educação Gráfica,ux,,
cf3ba7d6-b1ee-4054-95ff-a657729ec38d,24/08/2025 02:37:52,DESIGN-AIDED SCIENCE: O DESIGNER COMO PROMOTOR DE TECNOLOGIAS 3D PARA INOVAÇÃO EM PESQUISA CIENTÍFICA /DESIGN-AIDED SCIENCE: DESIGNER AS A PROMOTER OF 3D TECHNOLOGIES FOR INNOVATION IN SCIENTIFIC RESEARCH,Autor desconhecido,,Artigo,https://www.educacaografica.inf.br/artigos/design-aided-science-o-designer-como-promotor-de-tecnologias-3d-para-inovacao-em-pesquisa-cientifica-design-aided-science-designer-as-a-promoter-of-3d-technologies-for-innovation-in-scientific-rese,Educação Gráfica,ux,,
e14ae693-8c2d-420d-8b85-29b3876dfd38,24/08/2025 02:37:52,APLICAÇÃO DE REQUISITOS DE INTERFACE PARA FACILITAR A COLABORAÇÃO DE USUÁRIOS NO MOODLE / USER INTERFACE REQUIREMENTS APPLICATION TO FACILITATE USER COLLABORATION IN MOODLE,Autor desconhecido,,Artigo,https://www.educacaografica.inf.br/artigos/aplicacao-de-requisitos-de-interface-para-facilitar-a-colaboracao-de-usuarios-no-moodle-user-interface-requirements-application-to-facilitate-user-collaboration-in-moodle,Educação Gráfica,ux,,
1422cbb3-8b6e-456a-9c92-f8ff67dc2070,24/08/2025 02:37:52,A PERCEPÇÃO DO USUÁRIO A PARTIR DO USO DE UM MODELO DE GESTÃO VISUAL DE PROJETOS: ESTUDOS DE CASO EM CURSOS DE DESIGN / USER PERCEPTION TOWARD THE USE OF VISUAL PROJECT MANAGEMENT MODEL: CASE STUDIES APPLIED IN DESIGN COURSES,Autor desconhecido,,Artigo,https://www.educacaografica.inf.br/artigos/a-percepcao-do-usuario-a-partir-do-uso-de-um-modelo-de-gestao-visual-de-projetos-estudos-de-caso-em-cursos-de-design-user-perception-toward-the-use-of-visual-project-management-model-case-studies,Educação Gráfica,ux,,
a0354e3d-b1af-4961-9948-34b4a2079271,24/08/2025 02:37:52,DESIGN PARA A EXPERIÊNCIA NO CONTEXTO DE HISTÓRIAS EM QUADRINHOS DIGITAIS /  EXPERIENCE DESIGN IN THE CONTEXT OF DIGITAL COMICS,Autor desconhecido,,Artigo,https://www.educacaografica.inf.br/artigos/design-para-a-experiencia-no-contexto-de-historias-em-quadrinhos-digitais-experience-design-in-the-context-of-digital-comics,Educação Gráfica,ux,,
018f18fa-7649-44d3-b700-ce5536e259ba,24/08/2025 02:37:52,TV DIGITAL INTERATIVA: DESENVOLVIMENTO DE UMA APLICAÇÃO PARA O ENSINO DE PERSPECTIVA E PONTOS DE FUGA  / INTERACTIVE TV: DEVELOPMENT OF AN APPLICATION FOR THE EDUCATION OF PERSPECTIVE AND VANISHING POINT,Autor desconhecido,,Artigo,https://www.educacaografica.inf.br/artigos/tv-digital-interativa-desenvolvimento-de-uma-aplicacao-para-o-ensino-de-perspectiva-e-pontos-de-fuga-interactive-tv-development-of-an-application-for-the-education-of-perspective-and-vanishing-po,Educação Gráfica,ux,,
aa874d7c-5d46-4c05-b3bf-a56a168cab8f,24/08/2025 02:37:52,RECURSOS DIGITAIS E O PROCESSO PROJETUAL PAISAGÍSTICO / DIGITAL RESOURCES AND THE LANDSCAPE DESIGN PROCESS,Autor desconhecido,,Artigo,https://www.educacaografica.inf.br/artigos/recursos-digitais-e-o-processo-projetual-paisagistico-digital-resources-and-the-landscape-design-process,Educação Gráfica,ux,,
ecce5491-c6fa-4c87-8ad5-31b0083af2a6,24/08/2025 02:37:52,"MODELAMENTO VIRTUAL, USINAGEM E PROTOTIPAGEM RÁPIDA: UMA EXPERIÊNCIA DIDÁTICO-PEDAGÓGICA PARA O DESENVOLVIMENTO DE PRODUTOS / VIRTUAL MODELING, PROCESSING AND RAPID PROTOTYPING: AN EDUCATIONAL EXPERIENCE FOR PRODUCTS DEVELOPMENT",Autor desconhecido,,Artigo,https://www.educacaografica.inf.br/artigos/modelamento-virtual-usinagem-e-prototipagem-rapida-uma-experiencia-didatico-pedagogica-para-o-desenvolvimento-de-produtos-virtual-modeling-processing-and-rapid-prototyping-an-educational-experie,Educação Gráfica,ux,,
90b9c9c0-e781-4b90-8399-a736754afe67,24/08/2025 02:37:52,SISTEMA DE DESIGN EM FACHADAS CORPORATIVAS: ANÁLISE DE GRANDES MARCAS,Autor desconhecido,,Artigo,https://www.educacaografica.inf.br/artigos/sistema-de-design-em-fachadas-corporativas-analise-de-grandes-marcas,Educação Gráfica,ux,,
89504770-03bb-4412-ac3d-6f14edbea930,24/08/2025 02:37:52,A EVOLUÇÃO DA INFORMAÇÃO GRÁFICA NOS PRODUTOS GRÁFICOS DE COMUNICAÇÃO DA MARCA CULTURAL FESTIVAL DE DANÇA DE JOINVILLE,Autor desconhecido,,Artigo,https://www.educacaografica.inf.br/artigos/a-evolucao-da-informacao-grafica-nos-produtos-graficos-de-comunicacao-da-marca-cultural-festival-de-danca-de-joinville,Educação Gráfica,ux,,
d039df36-8b7e-49ca-9ebe-e4089b932005,24/08/2025 02:37:52,ARQUITETURA DE INFORMAÇÃO PARA SISTEMAS DISTRIBUÍDOS,Autor desconhecido,,Artigo,https://www.educacaografica.inf.br/artigos/arquitetura-de-informacao-para-sistemas-distribuidos,Educação Gráfica,inteligência artificial,,
64994414-bc30-43bb-a4ed-d9817cf26d99,24/08/2025 02:37:52,"CONVERGÊNCIA METODOLÓGICA ENTRE DESIGN THINKING, DE INTERAÇÃO E INDUSTRIAL: PRINCÍPIOS PROJETUAIS VOLTADOS AO IDOSO JOVEM / METHODOLOGICAL CONVERGENCE BETWEEN DESIGN THINKING, INTERACTION DESIGN AND INDUSTRIAL DESIGN: PROJECTIVE PRINCIPLES ORIENTED TO YOUNG ELDERLY",Autor desconhecido,,Artigo,https://www.educacaografica.inf.br/artigos/convergencia-metodologica-entre-design-thinking-de-interacao-e-industrial-principios-projetuais-voltados-ao-idoso-jovem-methodological-convergence-between-design-thinking-interaction-design-and-i,Educação Gráfica,design thinking,,
2a587dcd-d08e-4e57-9b98-148042d5c943,24/08/2025 02:37:52,"APRENDER COM BRILHO NO OLHO: OBJETOS PEDAGÓGICOS COM DESIGN THINKING, INOVAÇÃO E TECNOLOGIA / LEARNING WITH A GLOW IN THE EYE: PEDAGOGICAL OBJECTS WITH DESIGN THINKING, INNOVATION AND TECHNOLOGY",Autor desconhecido,,Artigo,https://www.educacaografica.inf.br/artigos/aprender-com-brilho-no-olho-objetos-pedagogicos-com-design-thinking-inovacao-e-tecnologia-learning-with-a-glow-in-the-eye-pedagogical-objects-with-design-thinking-innovation-and-technology,Educação Gráfica,design thinking,,
1720cac5-f34e-42f1-9f7a-c067a2303f40,24/08/2025 02:37:52,O DESIGN THINKING NO PROCESSO CRIATIVO DE DESIGN DE SUPERFÍCIES: POTENCIAIS RELAÇÕES DE ENSINO COM AMPARO DO EAD/ THE DESIGN THINKING IN CREATIVE SURFACES DESIGN PROCESS: A POTENTIAL TEACHING RELATIONS WITH DISTANCE EDUCATION SUPPORT,Autor desconhecido,,Artigo,https://www.educacaografica.inf.br/artigos/o-design-thinking-no-processo-criativo-de-design-de-superficies-potenciais-relacoes-de-ensino-com-amparo-do-ead-the-design-thinking-in-creative-surfaces-design-process-a-potential-teaching-relation,Educação Gráfica,design thinking,,
9c6eff90-9e9f-421c-8b89-f01870620489,24/08/2025 02:37:52,PROPOSTA DE METODOLOGIA PARA O ENSINO E O DESENVOLVIMENTO DE JOGOS DIGITAIS BASEADA EM DESIGN THINKING / A METHODOLOGY PROPOSAL FOR EDUCATION AND DEVELOPMENT OF GAMES BASED ON DESIGN THINKING,Autor desconhecido,,Artigo,https://www.educacaografica.inf.br/artigos/proposta-de-metodologia-para-o-ensino-e-o-desenvolvimento-de-jogos-digitais-baseada-em-design-thinking-a-methodology-proposal-for-education-and-development-of-games-based-on-design-thinking,Educação Gráfica,design thinking,,
8318bb22-96a7-4442-9899-f0fdde33f636,24/08/2025 02:37:52,CAMINHANDO NAS LENDAS: USO DO DESIGN THINKING PARA DESENVOLVIMENTO DE JOGO DE TABULEIRO CULTURAL / WALKING ON LEGENDS: USE OF DESIGN THINKING FOR CULTURAL BOARD GAME DEVELOPMENT,Autor desconhecido,,Artigo,https://www.educacaografica.inf.br/artigos/caminhando-nas-lendas-uso-do-design-thinking-para-desenvolvimento-de-jogo-de-tabuleiro-cultural-walking-on-legends-use-of-design-thinking-for-cultural-board-game-development,Educação Gráfica,design thinking,,
7fbd517d-3fae-48e5-9634-c3991617a254,24/08/2025 02:37:52,DESIGN DO ANUÁRIO DO CEARÁ 2010-2011: UM ESTUDO DE DESIGN THINKING E GESTÃO DE DESIGN EDITORIAL,Autor desconhecido,,Artigo,https://www.educacaografica.inf.br/artigos/design-do-anuario-do-ceara-2010-2011-um-estudo-de-design-thinking-e-gestao-de-design-editorial,Educação Gráfica,design thinking,,
148d0252-3ee7-4101-9bb6-647c5729b74b,24/08/2025 02:37:52,O PENSAR HÍBRIDO CONTEMPORÂNEO NO DESIGN E NA FOTOGRAFIA: DIÁLOGOS ENTRE O ARTESANAL E O DIGITAL  / THE CONTEMPORARY HYBRID THINKING IN DESIGN AND PHOTOGRAPHY: DIALOGUES BETWEEN HANDCRAFTED AND DIGITAL TECHNIQUES,Autor desconhecido,,Artigo,https://www.educacaografica.inf.br/artigos/o-pensar-hibrido-contemporaneo-no-design-e-na-fotografia-dialogos-entre-o-artesanal-e-o-digital-the-contemporary-hybrid-thinking-in-design-and-photography-dialogues-between-handcrafted-and-digita,Educação Gráfica,design thinking,,
b3b69639-3d57-4d69-b83b-a28b55c3d211,24/08/2025 02:37:52,UMA EXPERIÊNCIA DE ENSINO REMOTO DA DISCIPLINA DE DESENHO GEOMÉTRICO PARA OS CURSOS DE DESIGN GRÁFICO E INDUSTRIAL (2020-2021) / AN EXPERIENCE IN TEACHING GEOMETRY REMOTELY FOR A GRAPHIC AND INDUSTRIAL DESIGN COURSES (2020-2021),Autor desconhecido,,Artigo,https://www.educacaografica.inf.br/artigos/uma-experiencia-de-ensino-remoto-da-disciplina-de-desenho-geometrico-para-os-cursos-de-design-grafico-e-industrial-2020-2021-an-experience-in-teaching-geometry-remotely-for-a-graphic-and-industria,Educação Gráfica,design thinking,,
82fe20f1-8fd0-4088-8fe2-0580c7d1bb6f,24/08/2025 02:37:52,DESIGN DE SUPERFÍCIE: O TECIDO PIQUET PARAMETRIZADO DIGITALMENTE PARA NOVAS APLICAÇÕES / SURFACE DESIGN: THE PIQUET FABRIC DIGITALLY PARAMETERIZED FOR NEW APPLICATION,Autor desconhecido,,Artigo,https://www.educacaografica.inf.br/artigos/design-de-superficie-o-tecido-piquet-parametrizado-digitalmente-para-novas-aplicacoes-surface-design-the-piquet-fabric-digitally-parameterized-for-new-application,Educação Gráfica,design thinking,,
5951f9d9-d5c1-418d-8a70-3bdc8a05cd6c,24/08/2025 02:37:52,"IMAGENS GRÁFICAS DIGITAIS EM REMIX: DESIGN, LINGUAGEM E COMUNICAÇÃO / DIGITAL GRAPHIC IMAGES IN REMIX: DESIGN, LANGUAGE AND COMMUNICATION",Autor desconhecido,,Artigo,https://www.educacaografica.inf.br/artigos/imagens-graficas-digitais-em-remix-design-linguagem-e-comunicacao-digital-graphic-images-in-remix-design-language-and-communication,Educação Gráfica,design thinking,,
5d8ec831-c8df-4e0a-98b3-bf932100555f,24/08/2025 02:37:52,A ERGONOMIA E A INFORMAÇÃO VISUAL: PROBLEMAS TIPOGRÁFICOS NO DESIGN DE JORNAL,Autor desconhecido,,Artigo,https://www.educacaografica.inf.br/artigos/a-ergonomia-e-a-informacao-visual-problemas-tipograficos-no-design-de-jornal,Educação Gráfica,design thinking,,
df0ad3fb-b901-4528-80ec-6a8ed8d47eb9,24/08/2025 02:37:52,INTRODUÇÃO DE UMA NOVA TECNOLOGIA NO PROCESSO PROJETUAL – REFLEXÕES SOBRE A POSSIBILIDADE DE INTERAÇÃO SISTEMAS ESPECIALISTAS E O DESIGN,Autor desconhecido,,Artigo,https://www.educacaografica.inf.br/artigos/introducao-de-uma-nova-tecnologia-no-processo-projetual-reflexoes-sobre-a-possibilidade-de-interacao-sistemas-especialistas-e-o-design,Educação Gráfica,design thinking,,
1ef3a806-7369-40db-bae6-ea1e3c510836,24/08/2025 02:37:52,TECNOLOGIAS DIGITAIS DE REPRESENTAÇÃO EM ARQUITETURA E URBANISMO / DIGITAL TECHNOLOGIES OF REPRESENTATION AND ANALYSIS IN  ARCHITECTURE AND URBANISM,Autor desconhecido,,Artigo,https://www.educacaografica.inf.br/artigos/tecnologias-digitais-de-representacao-em-arquitetura-e-urbanismo-digital-technologies-of-representation-and-analysis-in-architecture-and-urbanism,Educação Gráfica,design thinking,,
